{
  "schema_version": "1.0.0",
  "id": "project-draft",
  "name": "草稿项目",
  "purpose": "等待用户确认的项目边界。",
  "status": "draft",
  "series_ids": [],
  "skill_id": null,
  "document_ids": [],
  "default_scope": "project_only",
  "cross_project_policy": {
    "mode": "single_grant_required",
    "grant_ids": []
  },
  "revision": 1,
  "created_at": "2026-06-29T14:00:00+08:00",
  "updated_at": "2026-06-29T14:00:00+08:00"
}
